{
  "schema_version": "1.0.0",
  "tile_id": "tile_0",
  "observation_date": "2026-07-03",
  "bbox": [22.433493, 38.837552, 22.438, 38.842],
  "collection_status": "collected",
  "water_status": "water",
  "water_pct": 12.5,
  "cloud_pct": 1.2,
  "valid_pixels": 65536,
  "source_scene_count": 1,
  "stac_item_ids": ["S2_EXAMPLE_ITEM"],
  "asset_paths": {},
  "quality_flags": [],
  "attempt_count": 1,
  "created_at": "2026-07-14T00:00:00Z",
  "updated_at": "2026-07-14T00:00:00Z",
  "CDOM": 14.4,
  "Chl_a": 9.4,
  "Color": 94.6,
  "Cya": 332.7,
  "DOC": 27.2,
  "Turb": 4.5,
  "WQI": -0.006
}
